<?xml version="1.0" encoding="UTF-8"?>
<vod:CatalogoVOD Version="2.0"
    xmlns:vod="http://starfire.com/vod"
    xmlns:xsi="http://www.w3.org/2001/XMLSchema-instance"
    xsi:schemaLocation="http://starfire.com/vod serviciovod_ns.xsd">
    <vod:cuenta correo="carlos.conderl@correo.buap.mx">
        <vod:perfiles>
            <vod:perfil usuario="NeoJC" idioma="Español"/>
            <vod:perfil usuario="Brother" idioma="Español"/>
        </vod:perfiles>
    </vod:cuenta>
    <vod:contenido>
        <vod:peliculas region="MEX">
            <vod:genero nombre="Super Héroes">
                <vod:titulo duracion="2:37">ETERNALS</vod:titulo>
                <vod:titulo duracion="2:04">CAPITAN AMÉRICA, EL 1ER VENGADOR</vod:titulo>
            </vod:genero>
            <vod:genero nombre="Animadas">
                <vod:titulo duracion="1:40">RED</vod:titulo>
                <vod:titulo duracion="1:47">RAYA</vod:titulo>
            </vod:genero>
        </vod:peliculas>
        <vod:series region="USA">
            <vod:genero nombre="Comedia">
                <vod:titulo duracion="0:30">FRIENDS</vod:titulo>
                <vod:titulo duracion="0:40">HOW I MEET YOUR MOTHER</vod:titulo>
            </vod:genero>
            <vod:genero nombre="Suspenso">
                <vod:titulo duracion="0:30">Stranger Things</vod:titulo>
                <vod:titulo duracion="0:45">Criminal Minds</vod:titulo>
            </vod:genero>
        </vod:series>
    </vod:contenido>
</vod:CatalogoVOD>